{
  "blockers": [],
  "claim_boundary": "This run record covers only the declared target skill, selected route, phase evidence, and local checks captured in this file.",
  "closure_decision": "accepted",
  "commands_run": [
    {
      "command": "start-run",
      "decision": "pass",
      "evidence_id": "task_summary"
    },
    {
      "command": "advance-run:inventory:checked",
      "decision": "pass",
      "evidence_id": "inventory"
    },
    {
      "command": "advance-run:inventory:check:check_phase_order",
      "decision": "pass",
      "evidence_id": "check_phase_order"
    },
    {
      "command": "advance-run:evidence:checked",
      "decision": "pass",
      "evidence_id": "evidence"
    },
    {
      "command": "advance-run:evidence:check:check_evidence",
      "decision": "pass",
      "evidence_id": "check_evidence"
    },
    {
      "command": "advance-run:checks:checked",
      "decision": "pass",
      "evidence_id": "checks"
    },
    {
      "command": "advance-run:checks:check:check_quality_floor",
      "decision": "pass",
      "evidence_id": "check_quality_floor"
    },
    {
      "command": "advance-run:closure:checked",
      "decision": "pass",
      "evidence_id": "closure"
    },
    {
      "command": "advance-run:closure:check:check_closure",
      "decision": "pass",
      "evidence_id": "check_closure"
    },
    {
      "command": "advance-run:intake:checked",
      "decision": "pass",
      "evidence_id": "intake"
    },
    {
      "command": "advance-run:intake:check:check_route",
      "decision": "pass",
      "evidence_id": "check_route"
    },
    {
      "command": "close-run:accepted",
      "decision": "pass",
      "evidence_id": "closure_report"
    },
    {
      "command": "advance-run:closure:checked",
      "decision": "pass",
      "evidence_id": "closure"
    },
    {
      "command": "advance-run:closure:check:check_closure",
      "decision": "pass",
      "evidence_id": "check_closure"
    }
  ],
  "contract_ref": {
    "contract_hash": "46E2050E930D8C06236F20BB806AEAEEAE2969C9393D27A352BA1684A9C03553",
    "contract_path": ".agents/skills/skillguard-global-router/.skillguard/work-contract.json",
    "contract_version": "1"
  },
  "current_phase": "closure",
  "evidence": [
    {
      "evidence_id": "task_summary",
      "fresh": true,
      "kind": "task_record",
      "phase_id": "intake",
      "source_path": ".agents/skills/skillguard-global-router/.skillguard/runs/run-1e850f38c5c98c92.json"
    },
    {
      "evidence_id": "target_inventory",
      "fresh": true,
      "kind": "phase_evidence",
      "phase_id": "inventory",
      "source_path": ".agents/skills/skillguard-global-router/SKILL.md"
    },
    {
      "evidence_id": "direct_evidence",
      "fresh": true,
      "kind": "phase_evidence",
      "phase_id": "evidence",
      "source_path": ".agents/skills/skillguard/fixtures/evidence_outputs/check_global_prompt_current.json"
    },
    {
      "evidence_id": "check_output",
      "fresh": true,
      "kind": "phase_evidence",
      "phase_id": "checks",
      "source_path": ".agents/skills/skillguard/fixtures/evidence_outputs/audit_installed_skills_current.json"
    },
    {
      "evidence_id": "closure_report",
      "fresh": true,
      "kind": "phase_evidence",
      "phase_id": "closure",
      "source_path": ".agents/skills/skillguard/fixtures/evidence_outputs/check_global_prompt_current.json"
    }
  ],
  "phase_statuses": [
    {
      "phase_id": "intake",
      "status": "checked"
    },
    {
      "phase_id": "inventory",
      "status": "checked"
    },
    {
      "phase_id": "evidence",
      "status": "checked"
    },
    {
      "phase_id": "checks",
      "status": "checked"
    },
    {
      "phase_id": "closure",
      "status": "checked"
    }
  ],
  "quality_failures": [],
  "run_id": "run-1e850f38c5c98c92",
  "schema_version": "skillguard.run_record.v1",
  "selected_route": "audit",
  "skipped_checks": [],
  "target_skill": ".agents/skills/skillguard-global-router",
  "task_summary": "Refresh SkillGuard global router deep contract after check-depth schema upgrade"
}
