{
  "schema_version": "skillguard.run_record.v1",
  "run_id": "{{run_id}}",
  "target_skill": "{{target_skill}}",
  "task_summary": "{{task_summary}}",
  "contract_ref": {
    "contract_path": ".skillguard/work-contract.json",
    "contract_version": "1",
    "contract_hash": "{{contract_hash}}"
  },
  "selected_route": "{{selected_route}}",
  "current_phase": "intake",
  "phase_statuses": [
    {
      "phase_id": "intake",
      "status": "running"
    }
  ],
  "evidence": [],
  "commands_run": [],
  "skipped_checks": [],
  "blockers": [],
  "quality_failures": [],
  "closure_decision": "not_requested",
  "claim_boundary": "This run record is bounded to one selected route and the current local evidence attached to this run."
}
