{
  "blockers": [],
  "claim_boundary": "This run record covers only the declared target skill, selected route, phase evidence, and local checks captured in this file.",
  "closure_decision": "accepted",
  "commands_run": [
    {
      "command": "start-run",
      "decision": "pass",
      "evidence_id": "task_summary"
    },
    {
      "command": "advance-run:intake:checked",
      "decision": "pass",
      "evidence_id": "intake"
    },
    {
      "command": "advance-run:intake:check:check_route",
      "decision": "pass",
      "evidence_id": "check_route"
    },
    {
      "command": "advance-run:inventory:checked",
      "decision": "pass",
      "evidence_id": "inventory"
    },
    {
      "command": "advance-run:inventory:check:check_phase_order",
      "decision": "pass",
      "evidence_id": "check_phase_order"
    },
    {
      "command": "advance-run:evidence:checked",
      "decision": "pass",
      "evidence_id": "evidence"
    },
    {
      "command": "advance-run:evidence:check:check_evidence",
      "decision": "pass",
      "evidence_id": "check_evidence"
    },
    {
      "command": "advance-run:checks:checked",
      "decision": "pass",
      "evidence_id": "checks"
    },
    {
      "command": "advance-run:checks:check:check_quality_floor",
      "decision": "pass",
      "evidence_id": "check_quality_floor"
    },
    {
      "command": "advance-run:closure:checked",
      "decision": "pass",
      "evidence_id": "closure"
    },
    {
      "command": "advance-run:closure:check:check_closure",
      "decision": "pass",
      "evidence_id": "check_closure"
    },
    {
      "command": "close-run:accepted",
      "decision": "pass",
      "evidence_id": "closure_report"
    }
  ],
  "contract_ref": {
    "contract_hash": "0D9CC6CF422D5B41A957ED1F0241264D86B7FEFF87BE6B4719C002C9356B159B",
    "contract_path": ".agents/skills/skillguard/.skillguard/work-contract.json",
    "contract_version": "1"
  },
  "current_phase": "closure",
  "evidence": [
    {
      "evidence_id": "task_summary",
      "fresh": true,
      "kind": "task_record",
      "phase_id": "intake",
      "source_path": ".agents/skills/skillguard/.skillguard/runs/run-cc4a8b8c66e87498.json"
    },
    {
      "evidence_id": "target_inventory",
      "fresh": true,
      "kind": "phase_evidence",
      "phase_id": "inventory",
      "source_path": ".agents/skills/skillguard/.skillguard/work-contract.json"
    },
    {
      "evidence_id": "direct_evidence",
      "fresh": true,
      "kind": "phase_evidence",
      "phase_id": "evidence",
      "source_path": ".agents/skills/skillguard/SKILL.md"
    },
    {
      "evidence_id": "check_output",
      "fresh": true,
      "kind": "phase_evidence",
      "phase_id": "checks",
      "source_path": "tests/test_skillguard_local.py"
    },
    {
      "evidence_id": "closure_report",
      "fresh": true,
      "kind": "phase_evidence",
      "phase_id": "closure",
      "source_path": ".agents/skills/skillguard/.skillguard/check_manifest.json"
    }
  ],
  "phase_statuses": [
    {
      "phase_id": "intake",
      "status": "checked"
    },
    {
      "phase_id": "inventory",
      "status": "checked"
    },
    {
      "phase_id": "evidence",
      "status": "checked"
    },
    {
      "phase_id": "checks",
      "status": "checked"
    },
    {
      "phase_id": "closure",
      "status": "checked"
    }
  ],
  "quality_failures": [],
  "run_id": "run-cc4a8b8c66e87498",
  "schema_version": "skillguard.run_record.v1",
  "selected_route": "audit",
  "skipped_checks": [],
  "target_skill": ".agents/skills/skillguard",
  "task_summary": "SkillGuard self target-lock refresh after SKILL.md universal target-lock wording update"
}
