{
  "blockers": [],
  "claim_boundary": "This fixture run intentionally skips a required phase and must fail.",
  "closure_decision": "not_requested",
  "commands_run": [
    {
      "command": "advance-run:intake:check:check_route",
      "decision": "pass",
      "evidence_id": "check_route"
    },
    {
      "command": "advance-run:inventory:check:check_phase_order",
      "decision": "pass",
      "evidence_id": "check_phase_order"
    },
    {
      "command": "advance-run:evidence:check:check_evidence",
      "decision": "pass",
      "evidence_id": "check_evidence"
    },
    {
      "command": "advance-run:checks:check:check_quality_floor",
      "decision": "pass",
      "evidence_id": "check_quality_floor"
    },
    {
      "command": "advance-run:closure:check:check_closure",
      "decision": "pass",
      "evidence_id": "check_closure"
    }
  ],
  "contract_ref": {
    "contract_hash": "3A93A5454C33349A40BDDDB58E93945422DF63AA69CFE12B55EBDD182E732AB2",
    "contract_path": ".agents/skills/skillguard/fixtures/runtime_contract/contracts/runtime_owner_contract.json",
    "contract_version": "1"
  },
  "current_phase": "closure",
  "evidence": [
    {
      "evidence_id": "task_summary",
      "fresh": true,
      "kind": "task_record",
      "phase_id": "intake",
      "source_path": ".agents/skills/skillguard/fixtures/runtime_contract/runs/skipped_phase_run.json"
    },
    {
      "evidence_id": "target_inventory",
      "fresh": true,
      "kind": "file_inventory",
      "phase_id": "inventory",
      "source_path": ".agents/skills/skillguard/SKILL.md"
    },
    {
      "evidence_id": "direct_evidence",
      "fresh": true,
      "kind": "direct_evidence",
      "phase_id": "evidence",
      "source_path": ".agents/skills/skillguard/fixtures/evidence_outputs/check_contract_self_current.json"
    },
    {
      "evidence_id": "check_output",
      "fresh": true,
      "kind": "command_output",
      "phase_id": "checks",
      "source_path": ".agents/skills/skillguard/fixtures/evidence_outputs/check_run_self_complete_current.json"
    },
    {
      "evidence_id": "closure_report",
      "fresh": true,
      "kind": "closure_record",
      "phase_id": "closure",
      "source_path": ".agents/skills/skillguard/fixtures/evidence_outputs/close_run_self_accepted_current.json"
    }
  ],
  "phase_statuses": [
    {
      "phase_id": "intake",
      "status": "checked"
    },
    {
      "phase_id": "inventory",
      "status": "checked"
    },
    {
      "phase_id": "evidence",
      "status": "skipped"
    },
    {
      "phase_id": "checks",
      "status": "checked"
    },
    {
      "phase_id": "closure",
      "status": "checked"
    }
  ],
  "quality_failures": [],
  "run_id": "fixture-skipped-phase-run",
  "schema_version": "skillguard.run_record.v1",
  "selected_route": "audit",
  "skipped_checks": [],
  "target_skill": ".agents/skills/skillguard",
  "task_summary": "Fixture run with a skipped evidence phase."
}
